[
  {
    "id": "guia-estudos",
    "title": "Guia de estudos da disciplina",
    "description": "Resumo dos objetivos de cada aula e exercícios recomendados para revisão semanal.",
    "type": "reference",
    "link": "courses/algi/supplements/guia-estudos.pdf",
    "available": false,
    "metadata": {
      "generatedBy": "Equipe EDU",
      "model": "manual",
      "timestamp": "2024-06-14T00:00:00.000Z"
    }
  }
]
